{"countries":[{"cancellation_value_pence":81249179,"completed_orders":18019,"country":"United Kingdom","gross_sales_pence":900174409,"net_revenue_pence":818925230,"rank":1},{"cancellation_value_pence":78480,"completed_orders":94,"country":"Netherlands","gross_sales_pence":28544634,"net_revenue_pence":28466154,"rank":2},{"cancellation_value_pence":2014714,"completed_orders":288,"country":"EIRE","gross_sales_pence":28314052,"net_revenue_pence":26299338,"rank":3},{"cancellation_value_pence":716893,"completed_orders":457,"country":"Germany","gross_sales_pence":22867840,"net_revenue_pence":22150947,"rank":4},{"cancellation_value_pence":1230826,"completed_orders":392,"country":"France","gross_sales_pence":20962537,"net_revenue_pence":19731711,"rank":5},{"cancellation_value_pence":144404,"completed_orders":57,"country":"Australia","gross_sales_pence":13845381,"net_revenue_pence":13700977,"rank":6},{"cancellation_value_pence":70455,"completed_orders":54,"country":"Switzerland","gross_sales_pence":5706760,"net_revenue_pence":5636305,"rank":7},{"cancellation_value_pence":680253,"completed_orders":90,"country":"Spain","gross_sales_pence":6155856,"net_revenue_pence":5475603,"rank":8},{"cancellation_value_pence":28538,"completed_orders":98,"country":"Belgium","gross_sales_pence":4119634,"net_revenue_pence":4091096,"rank":9},{"cancellation_value_pence":178242,"completed_orders":36,"country":"Sweden","gross_sales_pence":3836783,"net_revenue_pence":3658541,"rank":10},{"cancellation_value_pence":207575,"completed_orders":19,"country":"Japan","gross_sales_pence":3741637,"net_revenue_pence":3534062,"rank":11},{"cancellation_value_pence":100198,"completed_orders":36,"country":"Norway","gross_sales_pence":3616544,"net_revenue_pence":3516346,"rank":12},{"cancellation_value_pence":438008,"completed_orders":58,"country":"Portugal","gross_sales_pence":3368305,"net_revenue_pence":2930297,"rank":13},{"cancellation_value_pence":21934,"completed_orders":41,"country":"Finland","gross_sales_pence":2254608,"net_revenue_pence":2232674,"rank":14},{"cancellation_value_pence":36415,"completed_orders":26,"country":"Channel Islands","gross_sales_pence":2044054,"net_revenue_pence":2007639,"rank":15},{"cancellation_value_pence":18720,"completed_orders":18,"country":"Denmark","gross_sales_pence":1895534,"net_revenue_pence":1876814,"rank":16},{"cancellation_value_pence":59273,"completed_orders":38,"country":"Italy","gross_sales_pence":1748324,"net_revenue_pence":1689051,"rank":17},{"cancellation_value_pence":64409,"completed_orders":16,"country":"Cyprus","gross_sales_pence":1350285,"net_revenue_pence":1285876,"rank":18},{"cancellation_value_pence":4436,"completed_orders":17,"country":"Austria","gross_sales_pence":1019868,"net_revenue_pence":1015432,"rank":19},{"cancellation_value_pence":557476,"completed_orders":11,"country":"Hong Kong","gross_sales_pence":1548300,"net_revenue_pence":990824,"rank":20},{"cancellation_value_pence":1215890,"completed_orders":7,"country":"Singapore","gross_sales_pence":2127929,"net_revenue_pence":912039,"rank":21},{"cancellation_value_pence":22744,"completed_orders":8,"country":"Israel","gross_sales_pence":812941,"net_revenue_pence":790197,"rank":22},{"cancellation_value_pence":12151,"completed_orders":19,"country":"Poland","gross_sales_pence":733465,"net_revenue_pence":721314,"rank":23},{"cancellation_value_pence":0,"completed_orders":13,"country":"Unspecified","gross_sales_pence":474094,"net_revenue_pence":474094,"rank":24},{"cancellation_value_pence":5000,"completed_orders":5,"country":"Greece","gross_sales_pence":476052,"net_revenue_pence":471052,"rank":25},{"cancellation_value_pence":0,"completed_orders":7,"country":"Iceland","gross_sales_pence":431000,"net_revenue_pence":431000,"rank":26},{"cancellation_value_pence":0,"completed_orders":6,"country":"Canada","gross_sales_pence":366638,"net_revenue_pence":366638,"rank":27},{"cancellation_value_pence":22012,"completed_orders":5,"country":"Malta","gross_sales_pence":272559,"net_revenue_pence":250547,"rank":28},{"cancellation_value_pence":0,"completed_orders":3,"country":"United Arab Emirates","gross_sales_pence":190228,"net_revenue_pence":190228,"rank":29},{"cancellation_value_pence":184947,"completed_orders":5,"country":"USA","gross_sales_pence":358039,"net_revenue_pence":173092,"rank":30},{"cancellation_value_pence":0,"completed_orders":1,"country":"Lebanon","gross_sales_pence":169388,"net_revenue_pence":169388,"rank":31},{"cancellation_value_pence":0,"completed_orders":4,"country":"Lithuania","gross_sales_pence":166106,"net_revenue_pence":166106,"rank":32},{"cancellation_value_pence":850,"completed_orders":4,"country":"European Community","gross_sales_pence":130025,"net_revenue_pence":129175,"rank":33},{"cancellation_value_pence":0,"completed_orders":1,"country":"Brazil","gross_sales_pence":114360,"net_revenue_pence":114360,"rank":34},{"cancellation_value_pence":0,"completed_orders":1,"country":"RSA","gross_sales_pence":100231,"net_revenue_pence":100231,"rank":35},{"cancellation_value_pence":11902,"completed_orders":2,"country":"Czech Republic","gross_sales_pence":82674,"net_revenue_pence":70772,"rank":36},{"cancellation_value_pence":20574,"completed_orders":3,"country":"Bahrain","gross_sales_pence":75414,"net_revenue_pence":54840,"rank":37},{"cancellation_value_pence":1475,"completed_orders":1,"country":"Saudi Arabia","gross_sales_pence":14592,"net_revenue_pence":13117,"rank":38}],"customers":{"anonymous_completed_orders":1428,"frequency_bands":[{"band":"1","completed_order_count":1493,"customer_count":1493,"net_revenue_pence":51884364},{"band":"2–3","completed_order_count":3194,"customer_count":1343,"net_revenue_pence":111990133},{"band":"4–5","completed_order_count":2762,"customer_count":630,"net_revenue_pence":96799384},{"band":"6+","completed_order_count":11083,"customer_count":872,"net_revenue_pence":568219185}],"identified_customers":4338,"repeat_customers":2845,"repeat_rate_bps":6558},"kpis":{"average_order_value_pence":53317,"cancellation_orders":3836,"cancellation_rate_bps":1612,"cancellation_rate_denominator":23796,"cancellation_rate_numerator":3836,"cancellation_value_pence":89397973,"completed_orders":19960,"gross_sales_pence":1064211080,"identified_customers":4338,"net_revenue_pence":974813107,"repeat_customer_rate_bps":6558,"repeat_customer_rate_denominator":4338,"repeat_customer_rate_numerator":2845,"repeat_customers":2845},"metadata":{"canonical_row_count":536641,"contract_version":"1.0.0","currency_code":"GBP","dataset_id":"uci-352","dataset_title":"Online Retail","license":"CC BY 4.0","period_end":"2011-12-09","period_start":"2010-12-01","pipeline_version":"1.0.0","raw_row_count":541909,"source_doi":"10.24432/C5BW33","source_sha256":"43465a06f2ccf7c8b5bd2892bc7defb52f97487934fe93b16ae4c3936424676d"},"monthly":[{"cancellation_orders":326,"cancellation_value_pence":7472912,"completed_orders":1559,"gross_sales_pence":82145273,"month":"2010-12","net_revenue_pence":74672361},{"cancellation_orders":260,"cancellation_value_pence":13136305,"completed_orders":1086,"gross_sales_pence":68981161,"month":"2011-01","net_revenue_pence":55844856},{"cancellation_orders":219,"cancellation_value_pence":2551915,"completed_orders":1100,"gross_sales_pence":52254556,"month":"2011-02","net_revenue_pence":49702641},{"cancellation_orders":318,"cancellation_value_pence":3420128,"completed_orders":1454,"gross_sales_pence":71621526,"month":"2011-03","net_revenue_pence":68201398},{"cancellation_orders":240,"cancellation_value_pence":4460065,"completed_orders":1246,"gross_sales_pence":53696849,"month":"2011-04","net_revenue_pence":49236784},{"cancellation_orders":314,"cancellation_value_pence":4720251,"completed_orders":1681,"gross_sales_pence":76929661,"month":"2011-05","net_revenue_pence":72209410},{"cancellation_orders":329,"cancellation_value_pence":7056978,"completed_orders":1533,"gross_sales_pence":76054701,"month":"2011-06","net_revenue_pence":68997723},{"cancellation_orders":270,"cancellation_value_pence":3791913,"completed_orders":1475,"gross_sales_pence":71807612,"month":"2011-07","net_revenue_pence":68015699},{"cancellation_orders":278,"cancellation_value_pence":5433080,"completed_orders":1361,"gross_sales_pence":75784138,"month":"2011-08","net_revenue_pence":70351058},{"cancellation_orders":333,"cancellation_value_pence":3883851,"completed_orders":1837,"gross_sales_pence":105643519,"month":"2011-09","net_revenue_pence":101759668},{"cancellation_orders":362,"cancellation_value_pence":8189550,"completed_orders":2040,"gross_sales_pence":115126373,"month":"2011-10","net_revenue_pence":106936823},{"cancellation_orders":441,"cancellation_value_pence":4772098,"completed_orders":2769,"gross_sales_pence":150386678,"month":"2011-11","net_revenue_pence":145614580},{"cancellation_orders":146,"cancellation_value_pence":20508927,"completed_orders":819,"gross_sales_pence":63779033,"month":"2011-12","net_revenue_pence":43270106}],"products":[{"cancellation_value_pence":329,"cumulative_net_revenue_bps":212,"description":"DOTCOM POSTAGE","gross_sales_pence":20624877,"net_revenue_pence":20624548,"rank":1,"stock_code":"DOT"},{"cancellation_value_pence":969705,"cumulative_net_revenue_bps":380,"description":"REGENCY CAKESTAND 3 TIER","gross_sales_pence":17415654,"net_revenue_pence":16445949,"rank":2,"stock_code":"22423"},{"cancellation_value_pence":120135,"cumulative_net_revenue_bps":481,"description":"PARTY BUNTING","gross_sales_pence":9944523,"net_revenue_pence":9824388,"rank":3,"stock_code":"47566"},{"cancellation_value_pence":662430,"cumulative_net_revenue_bps":581,"description":"WHITE HANGING HEART T-LIGHT HOLDER","gross_sales_pence":10446275,"net_revenue_pence":9783845,"rank":4,"stock_code":"85123A"},{"cancellation_value_pence":198402,"cumulative_net_revenue_bps":676,"description":"JUMBO BAG RED RETROSPOT","gross_sales_pence":9415981,"net_revenue_pence":9217579,"rank":5,"stock_code":"85099B"},{"cancellation_value_pence":20840,"cumulative_net_revenue_bps":744,"description":"RABBIT N